MSN_data,MSN,desc,unit,state,year,data
ABICB,ABICP,Aviation gasoline blending components consumed by the industrial sector.,Thousand barrels,CA,1968,0.0
ARICB,ARICP,Asphalt and road oil consumed by the industrial sector.,Thousand barrels,CA,1968,78732.00371
ARTCB,ARTCP,Asphalt and road oil total consumption.,Thousand barrels,CA,1968,78732.00371
ARTXB,ARTXP,Asphalt and road oil total end-use consumption.,Thousand barrels,CA,1968,78732.00371
AVACB,AVACP,Aviation gasoline consumed by the transportation sector.,Thousand barrels,CA,1968,14375.77724
AVTCB,AVTCP,Aviation gasoline total consumption.,Thousand barrels,CA,1968,14375.77724
AVTXB,AVTXP,Aviation gasoline total end-use consumption.,Thousand barrels,CA,1968,14375.77724
CLACB,CLACP,Coal consumed by the transportation sector.,Thousand short tons,CA,1968,117.12871
CLCCB,CLCCP,Coal consumed by the commercial sector.,Thousand short tons,CA,1968,97.7967
CLEIB,CLEIP,Coal consumed by the electric power sector.,Thousand short tons,CA,1968,0.0
CLKCB,CLKCP,Coal consumed at coke plants (coking coal).,Thousand short tons,CA,1968,56293.07465
CLOCB,CLOCP,Coal consumed by industrial users other than coke plants.,Thousand short tons,CA,1968,378.16455
CLPRB,CLPRP,Coal production.,Thousand short tons,CA,1968,0.0
CLRCB,CLRCP,Coal consumed by the residential sector.,Thousand short tons,CA,1968,124.46861
COICB,COICP,Crude oil consumed by the industrial sector.,Thousand barrels,CA,1968,0.0
DFACB,DFACP,Distillate fuel oil consumed by the transportation sector.,Thousand barrels,CA,1968,155257.4256
DFCCB,DFCCP,Distillate fuel oil consumed by the commercial sector.,Thousand barrels,CA,1968,3389.92364
DFICB,DFICP,Distillate fuel oil consumed by the industrial sector.,Thousand barrels,CA,1968,63011.75011
DFRCB,DFRCP,Distillate fuel oil consumed by the residential sector.,Thousand barrels,CA,1968,2581.55991
ELEXB,ELEXP,Electricity exported from the United States.,Million kilowatthours,CA,1968,0.0
ELIMB,ELIMP,Electricity imported into the United States.,Million kilowatthours,CA,1968,0.0
EMTCB,EMTCP,"Fuel ethanol, excluding denaturant, total consumption.",Thousand barrels,CA,1968,0.0
ESACB,ESACP,"Electricity consumed by (i.e., sold to) the transportation sector.",Million kilowatthours,CA,1968,223.40766
ESCCB,ESCCP,"Electricity consumed by (i.e., sold to) the commercial sector.",Million kilowatthours,CA,1968,125635.8757
ESICB,ESICP,"Electricity consumed by (i.e., sold to) the industrial sector.",Million kilowatthours,CA,1968,126713.2285
ESRCB,ESRCP,"Electricity consumed by (i.e., sold to) the residential sector.",Million kilowatthours,CA,1968,104375.4343
ESTCB,ESTCP,"Electricity total consumption (i.e., sold).",Million kilowatthours,CA,1968,356947.9461
FNICB,FNICP,"Petrochemical feedstocks, naphtha less than 401 degrees F, consumed by the industrial sector.",Thousand barrels,CA,1968,9004.76154
FOICB,FOICP,"Petrochemical feedstocks, other oils equal to or greater than 401 degrees F, consumed by the industrial sector.",Thousand barrels,CA,1968,4937.20144
FSICB,FSICP,"Petrochemical feedstocks, still gas, consumed by the industrial sector.",Thousand barrels,CA,1968,7796.655
GEEGB,GEEGP,Electricity produced from geothermal energy by the electric power sector.,Million kilowatthours,CA,1968,4531.71875
HYCCB,HYCCP,Hydroelectricity produced in the commercial sector.,Million kilowatthours,CA,1968,0.0
HYEGB,HYEGP,Hydroelectricity produced by the electric power sector.,Million kilowatthours,CA,1968,282560.503
HYICB,HYICP,Hydroelectricity produced in the industrial sector.,Million kilowatthours,CA,1968,0.0
JFTXB,JFTXP,Jet fuel total end-use consumption.,Thousand barrels,CA,1968,336576.5997
JKACB,JKACP,Kerosene-type jet fuel consumed by the transportation sector.,Thousand barrels,CA,1968,216496.7097
JKTCB,JKTCP,Kerosene-type jet fuel total consumption.,Thousand barrels,CA,1968,216496.7097
JNACB,JNACP,Naphtha-type jet fuel consumed by the transportation sector.,Thousand barrels,CA,1968,120079.89
JNTCB,JNTCP,Naphtha-type jet fuel total consumption.,Thousand barrels,CA,1968,120079.89
KSCCB,KSCCP,Kerosene consumed by the commercial sector.,Thousand barrels,CA,1968,1891.67887
KSICB,KSICP,Kerosene consumed by the industrial sector.,Thousand barrels,CA,1968,889.5282
KSRCB,KSRCP,Kerosene consumed by the residential sector.,Thousand barrels,CA,1968,614.98481
LGACB,LGACP,LPG consumed by the transportation sector.,Thousand barrels,CA,1968,915.73314
LGCCB,LGCCP,LPG consumed by the commercial sector.,Thousand barrels,CA,1968,5377.04838
LGICB,LGICP,LPG consumed by the industrial sector.,Thousand barrels,CA,1968,25285.66996
LGRCB,LGRCP,LPG consumed by the residential sector.,Thousand barrels,CA,1968,15545.3189
LUACB,LUACP,Lubricants consumed by the transportation sector.,Thousand barrels,CA,1968,17698.14222
LUICB,LUICP,Lubricants consumed by the industrial sector.,Thousand barrels,CA,1968,11761.24551
MBICB,MBICP,Motor gasoline blending components consumed by the industrial sector.,Thousand barrels,CA,1968,0.0
MGACB,MGACP,Motor gasoline consumed by the transportation sector.,Thousand barrels,CA,1968,1011609.36
MGCCB,MGCCP,Motor gasoline consumed by the commercial sector.,Thousand barrels,CA,1968,7373.54312
MGICB,MGICP,Motor gasoline consumed by the industrial sector.,Thousand barrels,CA,1968,9182.20234
MSICB,MSICP,Miscellaneous petroleum products consumed by the industrial sector.,Thousand barrels,CA,1968,3190.32509
NAICB,NAICP,Natural gasoline consumed by the industrial sector.,Thousand barrels,CA,1968,0.0
NGACB,NGACP,Natural gas consumed by the transportation sector.,Million cubic feet,CA,1968,18023.34
NGCCB,NGCCP,Natural gas consumed by (delivered to) the commercial sector (including supplemental gaseous fuels).,Million cubic feet,CA,1968,203006.307
NGEIB,NGEIP,Natural gas consumed by the electric power sector (including supplemental gaseous fuels).,Million cubic feet,CA,1968,731532.9702
NGICB,NGICP,Natural gas consumed by (delivered to) the industrial sector (including supplemental gaseous fuels).,Million cubic feet,CA,1968,681344.254
NGLPB,NGLPP,Natural gas consumed as lease and plant fuel.,Million cubic feet,CA,1968,99496.106
NGMPB,NGMPP,Natural gas marketed production.,Million cubic feet,CA,1968,814570.8625
NGPZB,NGPZP,Natural gas consumed as pipeline fuel.,Million cubic feet,CA,1968,18023.34
NGRCB,NGRCP,Natural gas consumed by (delivered to) the residential sector (including supplemental gaseous fuels).,Million cubic feet,CA,1968,553352.884
NGTCB,NGTCP,Natural gas total consumption (including supplemental gaseous fuels).,Million cubic feet,CA,1968,2187259.755
NGVHB,NGVHP,Natural gas consumed as vehicle fuel.,Million cubic feet,CA,1968,0.0
NUEGB,NUEGP,Electricity produced from nuclear power by the electric power sector.,Million kilowatthours,CA,1968,17003.40842
NUETB,NUETP,Electricity produced from nuclear power.,Million kilowatthours,CA,1968,17003.40842
PAPRB,PAPRP,Crude oil production (including lease condensate).,Thousand barrels,CA,1968,2177876.8
PCCCB,PCCCP,Petroleum coke consumed by the commercial sector.,Thousand barrels,CA,1968,0.0
PCEIB,PCEIP,Petroleum coke consumed by the electric power sector.,Thousand barrels,CA,1968,0.0
PLICB,PLICP,Plant condensate consumed by the industrial sector.,Thousand barrels,CA,1968,0.0
PPICB,PPICP,Pentanes plus consumed by the industrial sector.,Thousand barrels,CA,1968,0.0
RFACB,RFACP,Residual fuel oil consumed by the transportation sector.,Thousand barrels,CA,1968,223997.3256
RFCCB,RFCCP,Residual fuel oil consumed by the commercial sector.,Thousand barrels,CA,1968,42585.69229
RFEIB,RFEIP,Residual fuel oil consumed by the electric power sector.,Thousand barrels,CA,1968,118887.7924
RFICB,RFICP,Residual fuel oil consumed by the industrial sector,Thousand barrels,CA,1968,79154.74577
SGICB,SGICP,Still gas consumed by the industrial sector.,Thousand barrels,CA,1968,118641.5821
SNICB,SNICP,Special naphthas consumed by the industrial sector.,Thousand barrels,CA,1968,16113.56626
SOEGB,SOEGP,Electricity produced from photovoltaic and solar thermal energy by the electric power sector.,Million kilowatthours,CA,1968,0.0
UOICB,UOICP,Unfinished oils consumed by the industrial sector.,Thousand barrels,CA,1968,0.0
USICB,USICP,Unfractionated stream consumed by the industrial sector.,Thousand barrels,CA,1968,0.0
WXICB,WXICP,Waxes consumed by the industrial sector.,Thousand barrels,CA,1968,2394.10163
WYEGB,WYEGP,Electricity produced from wind energy by the electric power sector.,Million kilowatthours,CA,1968,0.0
