MSN_data,MSN,desc,unit,state,year,data
ABICB,ABICP,Aviation gasoline blending components consumed by the industrial sector.,Thousand barrels,CA,1980,0.0
ARICB,ARICP,Asphalt and road oil consumed by the industrial sector.,Thousand barrels,CA,1980,122308.7164
ARTCB,ARTCP,Asphalt and road oil total consumption.,Thousand barrels,CA,1980,122308.7164
ARTXB,ARTXP,Asphalt and road oil total end-use consumption.,Thousand barrels,CA,1980,122308.7164
AVACB,AVACP,Aviation gasoline consumed by the transportation sector.,Thousand barrels,CA,1980,1440.35084
AVTCB,AVTCP,Aviation gasoline total consumption.,Thousand barrels,CA,1980,1440.35084
AVTXB,AVTXP,Aviation gasoline total end-use consumption.,Thousand barrels,CA,1980,1440.35084
CLACB,CLACP,Coal consumed by the transportation sector.,Thousand short tons,CA,1980,0.0
CLCCB,CLCCP,Coal consumed by the commercial sector.,Thousand short tons,CA,1980,73.02539
CLEIB,CLEIP,Coal consumed by the electric power sector.,Thousand short tons,CA,1980,0.0
CLKCB,CLKCP,Coal consumed at coke plants (coking coal).,Thousand short tons,CA,1980,40466.78274
CLOCB,CLOCP,Coal consumed by industrial users other than coke plants.,Thousand short tons,CA,1980,25610.39686
CLPRB,CLPRP,Coal production.,Thousand short tons,CA,1980,0.0
CLRCB,CLRCP,Coal consumed by the residential sector.,Thousand short tons,CA,1980,19.41181
COICB,COICP,Crude oil consumed by the industrial sector.,Thousand barrels,CA,1980,0.0
DFACB,DFACP,Distillate fuel oil consumed by the transportation sector.,Thousand barrels,CA,1980,243488.0514
DFCCB,DFCCP,Distillate fuel oil consumed by the commercial sector.,Thousand barrels,CA,1980,18784.76843
DFICB,DFICP,Distillate fuel oil consumed by the industrial sector.,Thousand barrels,CA,1980,90728.67595
DFRCB,DFRCP,Distillate fuel oil consumed by the residential sector.,Thousand barrels,CA,1980,550.08358
ELEXB,ELEXP,Electricity exported from the United States.,Million kilowatthours,CA,1980,43.74184
ELIMB,ELIMP,Electricity imported into the United States.,Million kilowatthours,CA,1980,346.86392
EMTCB,EMTCP,"Fuel ethanol, excluding denaturant, total consumption.",Thousand barrels,CA,1980,0.0
ESACB,ESACP,"Electricity consumed by (i.e., sold to) the transportation sector.",Million kilowatthours,CA,1980,691.26779
ESCCB,ESCCP,"Electricity consumed by (i.e., sold to) the commercial sector.",Million kilowatthours,CA,1980,216543.9482
ESICB,ESICP,"Electricity consumed by (i.e., sold to) the industrial sector.",Million kilowatthours,CA,1980,177041.856
ESRCB,ESRCP,"Electricity consumed by (i.e., sold to) the residential sector.",Million kilowatthours,CA,1980,177461.532
ESTCB,ESTCP,"Electricity total consumption (i.e., sold).",Million kilowatthours,CA,1980,571738.604
FNICB,FNICP,"Petrochemical feedstocks, naphtha less than 401 degrees F, consumed by the industrial sector.",Thousand barrels,CA,1980,9703.7954
FOICB,FOICP,"Petrochemical feedstocks, other oils equal to or greater than 401 degrees F, consumed by the industrial sector.",Thousand barrels,CA,1980,17552.3807
FSICB,FSICP,"Petrochemical feedstocks, still gas, consumed by the industrial sector.",Thousand barrels,CA,1980,12605.6043
GEEGB,GEEGP,Electricity produced from geothermal energy by the electric power sector.,Million kilowatthours,CA,1980,52699.14465
HYCCB,HYCCP,Hydroelectricity produced in the commercial sector.,Million kilowatthours,CA,1980,0.0
HYEGB,HYEGP,Hydroelectricity produced by the electric power sector.,Million kilowatthours,CA,1980,423618.4329
HYICB,HYICP,Hydroelectricity produced in the industrial sector.,Million kilowatthours,CA,1980,0.0
JFTXB,JFTXP,Jet fuel total end-use consumption.,Thousand barrels,CA,1980,348672.8609
JKACB,JKACP,Kerosene-type jet fuel consumed by the transportation sector.,Thousand barrels,CA,1980,278324.8927
JKTCB,JKTCP,Kerosene-type jet fuel total consumption.,Thousand barrels,CA,1980,283864.4827
JNACB,JNACP,Naphtha-type jet fuel consumed by the transportation sector.,Thousand barrels,CA,1980,70347.9682
JNTCB,JNTCP,Naphtha-type jet fuel total consumption.,Thousand barrels,CA,1980,70347.9682
KSCCB,KSCCP,Kerosene consumed by the commercial sector.,Thousand barrels,CA,1980,1258.74
KSICB,KSICP,Kerosene consumed by the industrial sector.,Thousand barrels,CA,1980,10642.59
KSRCB,KSRCP,Kerosene consumed by the residential sector.,Thousand barrels,CA,1980,102.06
LGACB,LGACP,LPG consumed by the transportation sector.,Thousand barrels,CA,1980,1918.36859
LGCCB,LGCCP,LPG consumed by the commercial sector.,Thousand barrels,CA,1980,5464.63919
LGICB,LGICP,LPG consumed by the industrial sector.,Thousand barrels,CA,1980,47348.47455
LGRCB,LGRCP,LPG consumed by the residential sector.,Thousand barrels,CA,1980,15798.54833
LUACB,LUACP,Lubricants consumed by the transportation sector.,Thousand barrels,CA,1980,17006.27716
LUICB,LUICP,Lubricants consumed by the industrial sector.,Thousand barrels,CA,1980,12754.70786
MBICB,MBICP,Motor gasoline blending components consumed by the industrial sector.,Thousand barrels,CA,1980,0.0
MGACB,MGACP,Motor gasoline consumed by the transportation sector.,Thousand barrels,CA,1980,1313775.941
MGCCB,MGCCP,Motor gasoline consumed by the commercial sector.,Thousand barrels,CA,1980,9427.59235
MGICB,MGICP,Motor gasoline consumed by the industrial sector.,Thousand barrels,CA,1980,8921.67545
MSICB,MSICP,Miscellaneous petroleum products consumed by the industrial sector.,Thousand barrels,CA,1980,4854.38196
NAICB,NAICP,Natural gasoline consumed by the industrial sector.,Thousand barrels,CA,1980,4157.42361
NGACB,NGACP,Natural gas consumed by the transportation sector.,Million cubic feet,CA,1980,15921.90006
NGCCB,NGCCP,Natural gas consumed by (delivered to) the commercial sector (including supplemental gaseous fuels).,Million cubic feet,CA,1980,269401.2206
NGEIB,NGEIP,Natural gas consumed by the electric power sector (including supplemental gaseous fuels).,Million cubic feet,CA,1980,545785.9434
NGICB,NGICP,Natural gas consumed by (delivered to) the industrial sector (including supplemental gaseous fuels).,Million cubic feet,CA,1980,507360.4193
NGLPB,NGLPP,Natural gas consumed as lease and plant fuel.,Million cubic feet,CA,1980,65561.86992
NGMPB,NGMPP,Natural gas marketed production.,Million cubic feet,CA,1980,342208.3289
NGPZB,NGPZP,Natural gas consumed as pipeline fuel.,Million cubic feet,CA,1980,15921.90006
NGRCB,NGRCP,Natural gas consumed by (delivered to) the residential sector (including supplemental gaseous fuels).,Million cubic feet,CA,1980,552410.7244
NGTCB,NGTCP,Natural gas total consumption (including supplemental gaseous fuels).,Million cubic feet,CA,1980,1890886.554
NGVHB,NGVHP,Natural gas consumed as vehicle fuel.,Million cubic feet,CA,1980,0.0
NUEGB,NUEGP,Electricity produced from nuclear power by the electric power sector.,Million kilowatthours,CA,1980,53664.94933
NUETB,NUETP,Electricity produced from nuclear power.,Million kilowatthours,CA,1980,53664.94933
PAPRB,PAPRP,Crude oil production (including lease condensate).,Thousand barrels,CA,1980,2070153.4
PCCCB,PCCCP,Petroleum coke consumed by the commercial sector.,Thousand barrels,CA,1980,0.0
PCEIB,PCEIP,Petroleum coke consumed by the electric power sector.,Thousand barrels,CA,1980,0.0
PLICB,PLICP,Plant condensate consumed by the industrial sector.,Thousand barrels,CA,1980,0.0
PPICB,PPICP,Pentanes plus consumed by the industrial sector.,Thousand barrels,CA,1980,0.0
RFACB,RFACP,Residual fuel oil consumed by the transportation sector.,Thousand barrels,CA,1980,419174.0725
RFCCB,RFCCP,Residual fuel oil consumed by the commercial sector.,Thousand barrels,CA,1980,42822.80367
RFEIB,RFEIP,Residual fuel oil consumed by the electric power sector.,Thousand barrels,CA,1980,393961.9415
RFICB,RFICP,Residual fuel oil consumed by the industrial sector,Thousand barrels,CA,1980,78925.72124
SGICB,SGICP,Still gas consumed by the industrial sector.,Thousand barrels,CA,1980,162442.7946
SNICB,SNICP,Special naphthas consumed by the industrial sector.,Thousand barrels,CA,1980,26413.20725
SOEGB,SOEGP,Electricity produced from photovoltaic and solar thermal energy by the electric power sector.,Million kilowatthours,CA,1980,0.0
UOICB,UOICP,Unfinished oils consumed by the industrial sector.,Thousand barrels,CA,1980,0.0
USICB,USICP,Unfractionated stream consumed by the industrial sector.,Thousand barrels,CA,1980,15.39173
WXICB,WXICP,Waxes consumed by the industrial sector.,Thousand barrels,CA,1980,3240.84957
WYEGB,WYEGP,Electricity produced from wind energy by the electric power sector.,Million kilowatthours,CA,1980,0.0
