MSN_data,MSN,desc,unit,state,year,data
ABICB,ABICP,Aviation gasoline blending components consumed by the industrial sector.,Thousand barrels,TX,2003,1991.58825
ARICB,ARICP,Asphalt and road oil consumed by the industrial sector.,Thousand barrels,TX,2003,92343.77999
ARTCB,ARTCP,Asphalt and road oil total consumption.,Thousand barrels,TX,2003,92343.77999
ARTXB,ARTXP,Asphalt and road oil total end-use consumption.,Thousand barrels,TX,2003,92343.77999
AVACB,AVACP,Aviation gasoline consumed by the transportation sector.,Thousand barrels,TX,2003,2581.39445
AVTCB,AVTCP,Aviation gasoline total consumption.,Thousand barrels,TX,2003,2581.39445
AVTXB,AVTXP,Aviation gasoline total end-use consumption.,Thousand barrels,TX,2003,2581.39445
CLACB,CLACP,Coal consumed by the transportation sector.,Thousand short tons,TX,2003,0.0
CLCCB,CLCCP,Coal consumed by the commercial sector.,Thousand short tons,TX,2003,2350.33264
CLEIB,CLEIP,Coal consumed by the electric power sector.,Thousand short tons,TX,2003,1528775.616
CLKCB,CLKCP,Coal consumed at coke plants (coking coal).,Thousand short tons,TX,2003,0.0
CLOCB,CLOCP,Coal consumed by industrial users other than coke plants.,Thousand short tons,TX,2003,72494.10925
CLPRB,CLPRP,Coal production.,Thousand short tons,TX,2003,594734.1761
CLRCB,CLRCP,Coal consumed by the residential sector.,Thousand short tons,TX,2003,351.19914
COICB,COICP,Crude oil consumed by the industrial sector.,Thousand barrels,TX,2003,0.0
DFACB,DFACP,Distillate fuel oil consumed by the transportation sector.,Thousand barrels,TX,2003,526662.6068
DFCCB,DFCCP,Distillate fuel oil consumed by the commercial sector.,Thousand barrels,TX,2003,15295.55441
DFICB,DFICP,Distillate fuel oil consumed by the industrial sector.,Thousand barrels,TX,2003,110730.9756
DFRCB,DFRCP,Distillate fuel oil consumed by the residential sector.,Thousand barrels,TX,2003,1.27008
ELEXB,ELEXP,Electricity exported from the United States.,Million kilowatthours,TX,2003,1012.07051
ELIMB,ELIMP,Electricity imported into the United States.,Million kilowatthours,TX,2003,271.53979
EMTCB,EMTCP,"Fuel ethanol, excluding denaturant, total consumption.",Thousand barrels,TX,2003,1947.1199
ESACB,ESACP,"Electricity consumed by (i.e., sold to) the transportation sector.",Million kilowatthours,TX,2003,307.08
ESCCB,ESCCP,"Electricity consumed by (i.e., sold to) the commercial sector.",Million kilowatthours,TX,2003,329920.7264
ESICB,ESICP,"Electricity consumed by (i.e., sold to) the industrial sector.",Million kilowatthours,TX,2003,356714.0057
ESRCB,ESRCP,"Electricity consumed by (i.e., sold to) the residential sector.",Million kilowatthours,TX,2003,414062.6663
ESTCB,ESTCP,"Electricity total consumption (i.e., sold).",Million kilowatthours,TX,2003,1101004.478
FNICB,FNICP,"Petrochemical feedstocks, naphtha less than 401 degrees F, consumed by the industrial sector.",Thousand barrels,TX,2003,221187.6078
FOICB,FOICP,"Petrochemical feedstocks, other oils equal to or greater than 401 degrees F, consumed by the industrial sector.",Thousand barrels,TX,2003,252373.5949
FSICB,FSICP,"Petrochemical feedstocks, still gas, consumed by the industrial sector.",Thousand barrels,TX,2003,0.0
GEEGB,GEEGP,Electricity produced from geothermal energy by the electric power sector.,Million kilowatthours,TX,2003,0.0
HYCCB,HYCCP,Hydroelectricity produced in the commercial sector.,Million kilowatthours,TX,2003,0.0
HYEGB,HYEGP,Hydroelectricity produced by the electric power sector.,Million kilowatthours,TX,2003,9181.4559
HYICB,HYICP,Hydroelectricity produced in the industrial sector.,Million kilowatthours,TX,2003,0.0
JFTXB,JFTXP,Jet fuel total end-use consumption.,Thousand barrels,TX,2003,574566.6221
JKACB,JKACP,Kerosene-type jet fuel consumed by the transportation sector.,Thousand barrels,TX,2003,574566.6221
JKTCB,JKTCP,Kerosene-type jet fuel total consumption.,Thousand barrels,TX,2003,574566.6221
JNACB,JNACP,Naphtha-type jet fuel consumed by the transportation sector.,Thousand barrels,TX,2003,0.0
JNTCB,JNTCP,Naphtha-type jet fuel total consumption.,Thousand barrels,TX,2003,0.0
KSCCB,KSCCP,Kerosene consumed by the commercial sector.,Thousand barrels,TX,2003,197.25794
KSICB,KSICP,Kerosene consumed by the industrial sector.,Thousand barrels,TX,2003,1110.85398
KSRCB,KSRCP,Kerosene consumed by the residential sector.,Thousand barrels,TX,2003,103.68837
LGACB,LGACP,LPG consumed by the transportation sector.,Thousand barrels,TX,2003,1759.54094
LGCCB,LGCCP,LPG consumed by the commercial sector.,Thousand barrels,TX,2003,12452.09023
LGICB,LGICP,LPG consumed by the industrial sector.,Thousand barrels,TX,2003,1505808.144
LGRCB,LGRCP,LPG consumed by the residential sector.,Thousand barrels,TX,2003,30784.33421
LUACB,LUACP,Lubricants consumed by the transportation sector.,Thousand barrels,TX,2003,10114.65612
LUICB,LUICP,Lubricants consumed by the industrial sector.,Thousand barrels,TX,2003,18173.14041
MBICB,MBICP,Motor gasoline blending components consumed by the industrial sector.,Thousand barrels,TX,2003,0.0
MGACB,MGACP,Motor gasoline consumed by the transportation sector.,Thousand barrels,TX,2003,1375226.522
MGCCB,MGCCP,Motor gasoline consumed by the commercial sector.,Thousand barrels,TX,2003,922.04541
MGICB,MGICP,Motor gasoline consumed by the industrial sector.,Thousand barrels,TX,2003,27304.57584
MSICB,MSICP,Miscellaneous petroleum products consumed by the industrial sector.,Thousand barrels,TX,2003,45452.69435
NAICB,NAICP,Natural gasoline consumed by the industrial sector.,Thousand barrels,TX,2003,0.0
NGACB,NGACP,Natural gas consumed by the transportation sector.,Million cubic feet,TX,2003,60103.47877
NGCCB,NGCCP,Natural gas consumed by (delivered to) the commercial sector (including supplemental gaseous fuels).,Million cubic feet,TX,2003,224901.1397
NGEIB,NGEIP,Natural gas consumed by the electric power sector (including supplemental gaseous fuels).,Million cubic feet,TX,2003,1483821.522
NGICB,NGICP,Natural gas consumed by (delivered to) the industrial sector (including supplemental gaseous fuels).,Million cubic feet,TX,2003,2198742.507
NGLPB,NGLPP,Natural gas consumed as lease and plant fuel.,Million cubic feet,TX,2003,278505.4446
NGMPB,NGMPP,Natural gas marketed production.,Million cubic feet,TX,2003,7008036.626
NGPZB,NGPZP,Natural gas consumed as pipeline fuel.,Million cubic feet,TX,2003,57826.14794
NGRCB,NGRCP,Natural gas consumed by (delivered to) the residential sector (including supplemental gaseous fuels).,Million cubic feet,TX,2003,212685.9788
NGTCB,NGTCP,Natural gas total consumption (including supplemental gaseous fuels).,Million cubic feet,TX,2003,4180255.726
NGVHB,NGVHP,Natural gas consumed as vehicle fuel.,Million cubic feet,TX,2003,2277.33083
NUEGB,NUEGP,Electricity produced from nuclear power by the electric power sector.,Million kilowatthours,TX,2003,348452.0208
NUETB,NUETP,Electricity produced from nuclear power.,Million kilowatthours,TX,2003,348452.0208
PAPRB,PAPRP,Crude oil production (including lease condensate).,Thousand barrels,TX,2003,2846892.68
PCCCB,PCCCP,Petroleum coke consumed by the commercial sector.,Thousand barrels,TX,2003,0.0
PCEIB,PCEIP,Petroleum coke consumed by the electric power sector.,Thousand barrels,TX,2003,7617.13716
PLICB,PLICP,Plant condensate consumed by the industrial sector.,Thousand barrels,TX,2003,0.0
PPICB,PPICP,Pentanes plus consumed by the industrial sector.,Thousand barrels,TX,2003,79689.56041
RFACB,RFACP,Residual fuel oil consumed by the transportation sector.,Thousand barrels,TX,2003,104668.792
RFCCB,RFCCP,Residual fuel oil consumed by the commercial sector.,Thousand barrels,TX,2003,0.0
RFEIB,RFEIP,Residual fuel oil consumed by the electric power sector.,Thousand barrels,TX,2003,3131.05174
RFICB,RFICP,Residual fuel oil consumed by the industrial sector,Thousand barrels,TX,2003,8852.27116
SGICB,SGICP,Still gas consumed by the industrial sector.,Thousand barrels,TX,2003,409539.9047
SNICB,SNICP,Special naphthas consumed by the industrial sector.,Thousand barrels,TX,2003,6422.63827
SOEGB,SOEGP,Electricity produced from photovoltaic and solar thermal energy by the electric power sector.,Million kilowatthours,TX,2003,0.0
UOICB,UOICP,Unfinished oils consumed by the industrial sector.,Thousand barrels,TX,2003,-13434.79177
USICB,USICP,Unfractionated stream consumed by the industrial sector.,Thousand barrels,TX,2003,0.0
WXICB,WXICP,Waxes consumed by the industrial sector.,Thousand barrels,TX,2003,1786.19024
WYEGB,WYEGP,Electricity produced from wind energy by the electric power sector.,Million kilowatthours,TX,2003,26317.86457
